{
  "project_id": "EMBER_OAK_SPOT_01",
  "stage": "produce",
  "status": "approved",
  "draft_file": "examples/ember-and-oak-demo/frames/frames.json",
  "checks": {
    "schema": "pass",
    "bible_match": "not_applicable"
  },
  "decision": "Approve",
  "decided_by": "Workshop director (demo stand-in)",
  "decided_at": "2026-10-22T22:16:30Z",
  "notes": "Shot 1 take 2; shot 2 seed 8000 (hand present; bag print is model gibberish, acceptable at insert size); shot 3 seed 9000 (both characters at counter).",
  "history": [
    {
      "at": "2026-10-22T22:16:30Z",
      "event": "draft_written",
      "by": "agent"
    },
    {
      "at": "2026-10-22T22:16:30Z",
      "event": "Approve",
      "by": "Workshop director (demo stand-in)",
      "note": "Shot 1 take 2; shot 2 seed 8000 (hand present; bag print is model gibberish, acceptable at insert size); shot 3 seed 9000 (both characters at counter)."
    }
  ]
}
